Authors,Year,Title,Source_Title,Key_Variable,Role_in_Model,Operationalization_Key_Variable,Secondary_Variable,Operationalization_Secondary_Variable,Study_Type,Country,Focal_Group,Tradition,Meta_Narrative
"Masood, A; Nisar, MA",2021,Administrative Capital and Citizens' Responses To Administrative Burden,Journal of Public Administration Research and Theory,Administrative burden,DV,Ethnography,Securing maternity leave,Ethnography,Qualitative,Pakistan,Citizens - Generic,Administrative Burden,Burden Genesis
"Mussagulova, A",2021,Predictors of Work Engagement: Drawing on Job Demands-Resources Theory and Public Service Motivation,Australian Journal of Public Administration,Red tape,IV,Survey,Work engagement,Survey,Quantitative,Moldova,Government - Managers or administrative workers,Red Tape,Behavioral Impact
"Oberfield, Z",2021,Unionization and Street-Level Bureaucracy: An Examination of Public School Teachers in the United States,Review of Public Personnel Administration,Red tape,DV,Survey,Unionization,Survey,Quantitative,USA,Government - Street-level bureaucrats,Red Tape,Rule Quality
"Pandey, SK",2021,The Psychological Process View of Bureaucratic Red Tape,Research Handbook on HRM in the Public Sector,Red tape,IV,Case study/Examples,Employee experience and well-being,NA,Theoretical,NA,Government - Managers or administrative workers,Red Tape,Behavioral Impact
"Peeters, R; Campos, SA",2021,Taking the Bite Out of Administrative Burdens: How Beneficiaries Of A Mexican Social Program Ease Administrative Burdens in Street-Level Interactions,Governance-An International Journal of Policy Administration and Institutions,Administrative burden,DV,Administrative data,Citizen behavioral and social resources,Interviews,Qualitative,Mexico,Citizens - Less advantaged,Administrative Burden,Burden Genesis
"Resh, WG; Barboza-Wilkes, CJ; Marvel, JD",2021,Procedural Environment of Public Engagement: An Induced Recall Experiment Of Local Government Employees,Public Management Review,Red tape,IV,Survey,Engagement (willingness to use public particiaption),Survey,Quantitative,USA,Government - Managers or administrative workers,Red Tape,Behavioral Impact
"Siverbo, S",2021,The Impact of Management Controls on Public Managers' Well-Being,Financial Accountability & Management,Red tape,IV,Survey,well-being,Survey,Quantitative,Sweden,Government - Managers or administrative workers,Red Tape,Behavioral Impact
"van Veen-Dirks, PMG; Leliveld, MC; Kaufmann, W",2021,The Effect of Enabling Versus Coercive Performance Measurement Systems on Procedural Fairness and Red Tape,Journal of Management Control,Red tape,DV,Survey,Enabling vs controlling managemen systems,Experiment - vignette,Quantitative,USA,Government - Street-level bureaucrats,Red Tape,Rule Quality
"Ahn, YJ; Campbell, JW",2022,"Red Tape, Rule Legitimacy, and Public Service Motivation: Experimental Evidence From Korean Citizens",Administration & Society,Red tape,DV,Survey,Legitimacy and outcome favorability,Experiment - survey,Quantitative,South Korea,Citizens - Generic,Red Tape,Rule Quality
